{"contractVersion":"1.0.0","capabilityEvidenceVersion":"2.0.0","auditId":"97d6b2c7-03b9-4530-8ea7-16557502c638","generatedAt":"2026-08-23T03:13:23.138Z","capabilities":{"content.body":{"capability":"content.body","status":"AVAILABLE","coverage":{"requested":5,"completed":5,"failed":0},"provenance":{"source":"dataforseo-onpage","adapterVersion":"1.2.0","artifactRef":"dataforseo://on_page/08230309-1281-0216-0000-1ebd25f37b7e?sha256=edd1be0ca0815d42325a76f15254a01fe7e62861f663222349e8dd4ff5eecf75"},"limitations":[],"requiredFieldsPresent":true},"offer.clarity":{"capability":"offer.clarity","status":"UNAVAILABLE","coverage":{"requested":null,"completed":null,"failed":null},"provenance":{"source":"dataforseo-onpage","adapterVersion":"1.2.0","artifactRef":"dataforseo://on_page/08230309-1281-0216-0000-1ebd25f37b7e?sha256=edd1be0ca0815d42325a76f15254a01fe7e62861f663222349e8dd4ff5eecf75"},"limitations":["Offer clarity requires body-content evidence (services, CTAs, forms, descriptions)"],"requiredFieldsPresent":false},"trust.proof":{"capability":"trust.proof","status":"UNAVAILABLE","coverage":{"requested":null,"completed":null,"failed":null},"provenance":{"source":"dataforseo-onpage","adapterVersion":"1.2.0","artifactRef":"dataforseo://on_page/08230309-1281-0216-0000-1ebd25f37b7e?sha256=edd1be0ca0815d42325a76f15254a01fe7e62861f663222349e8dd4ff5eecf75"},"limitations":["Trust proof requires body-content evidence (credentials, testimonials, policies)"],"requiredFieldsPresent":false},"conversion.cta":{"capability":"conversion.cta","status":"UNAVAILABLE","coverage":{"requested":null,"completed":null,"failed":null},"provenance":{"source":"dataforseo-onpage","adapterVersion":"1.2.0","artifactRef":"dataforseo://on_page/08230309-1281-0216-0000-1ebd25f37b7e?sha256=edd1be0ca0815d42325a76f15254a01fe7e62861f663222349e8dd4ff5eecf75"},"limitations":["Interactive extraction evidence was not collected"],"requiredFieldsPresent":false},"conversion.form":{"capability":"conversion.form","status":"UNAVAILABLE","coverage":{"requested":null,"completed":null,"failed":null},"provenance":{"source":"dataforseo-onpage","adapterVersion":"1.2.0","artifactRef":"dataforseo://on_page/08230309-1281-0216-0000-1ebd25f37b7e?sha256=edd1be0ca0815d42325a76f15254a01fe7e62861f663222349e8dd4ff5eecf75"},"limitations":["Interactive extraction evidence was not collected"],"requiredFieldsPresent":false},"conversion.path":{"capability":"conversion.path","status":"UNAVAILABLE","coverage":{"requested":null,"completed":null,"failed":null},"provenance":{"source":"dataforseo-onpage","adapterVersion":"1.2.0","artifactRef":"dataforseo://on_page/08230309-1281-0216-0000-1ebd25f37b7e?sha256=edd1be0ca0815d42325a76f15254a01fe7e62861f663222349e8dd4ff5eecf75"},"limitations":["Conversion path evidence was not collected","Browser validation not enabled for this run"],"requiredFieldsPresent":false,"kind":"inferred","validated":false,"validatedBy":null,"validationSummary":null},"technical.indexability":{"capability":"technical.indexability","status":"AVAILABLE","coverage":{"requested":1000,"completed":0,"failed":0},"provenance":{"source":"dataforseo-onpage","adapterVersion":"1.2.0","artifactRef":"dataforseo://on_page/08230309-1281-0216-0000-1ebd25f37b7e?sha256=edd1be0ca0815d42325a76f15254a01fe7e62861f663222349e8dd4ff5eecf75"},"limitations":[],"requiredFieldsPresent":true},"technical.redirects":{"capability":"technical.redirects","status":"AVAILABLE","coverage":{"requested":5,"completed":5,"failed":0},"provenance":{"source":"dataforseo-onpage","adapterVersion":"1.2.0","artifactRef":"dataforseo://on_page/08230309-1281-0216-0000-1ebd25f37b7e?sha256=edd1be0ca0815d42325a76f15254a01fe7e62861f663222349e8dd4ff5eecf75"},"limitations":[],"requiredFieldsPresent":true},"technical.resources":{"capability":"technical.resources","status":"AVAILABLE","coverage":{"requested":5,"completed":5,"failed":0},"provenance":{"source":"dataforseo-onpage","adapterVersion":"1.2.0","artifactRef":"dataforseo://on_page/08230309-1281-0216-0000-1ebd25f37b7e?sha256=edd1be0ca0815d42325a76f15254a01fe7e62861f663222349e8dd4ff5eecf75"},"limitations":[],"requiredFieldsPresent":true},"technical.headers":{"capability":"technical.headers","status":"UNAVAILABLE","coverage":{"requested":null,"completed":null,"failed":null},"provenance":{"source":"dataforseo-onpage","adapterVersion":"1.2.0","artifactRef":"dataforseo://on_page/08230309-1281-0216-0000-1ebd25f37b7e?sha256=edd1be0ca0815d42325a76f15254a01fe7e62861f663222349e8dd4ff5eecf75"},"limitations":["Response headers were not collected by the provider"],"requiredFieldsPresent":false},"schema.structured_data":{"capability":"schema.structured_data","status":"UNAVAILABLE","coverage":{"requested":1,"completed":0,"failed":1},"provenance":{"source":"dataforseo-onpage","adapterVersion":"1.2.0","artifactRef":"dataforseo://on_page/08230309-1281-0216-0000-1ebd25f37b7e?sha256=edd1be0ca0815d42325a76f15254a01fe7e62861f663222349e8dd4ff5eecf75"},"limitations":["Structured-data evidence was not collected"],"requiredFieldsPresent":false},"performance.lab":{"capability":"performance.lab","status":"AVAILABLE","coverage":{"requested":2,"completed":2,"failed":0},"provenance":{"source":"pagespeed-insights","adapterVersion":null,"artifactRef":null},"limitations":[],"requiredFieldsPresent":true},"performance.field":{"capability":"performance.field","status":"UNAVAILABLE","coverage":{"requested":2,"completed":2,"failed":0},"provenance":{"source":"pagespeed-insights","adapterVersion":null,"artifactRef":null},"limitations":["CrUX field data was not returned for this site (not populated or not collected)"],"requiredFieldsPresent":false}},"summary":{"total":13,"available":5,"partial":0,"unavailable":8,"failed":0,"notConnected":0,"notApplicable":0,"assessed":5}}