{
  "contractVersion": "1.0.0",
  "capabilityEvidenceVersion": "2.0.0",
  "auditId": "11111111-2222-4333-8444-555555555555",
  "generatedAt": "2026-08-16T12:00:00.000Z",
  "capabilities": {
    "content.body": {
      "capability": "content.body",
      "status": "AVAILABLE",
      "coverage": { "requested": 3, "completed": 3, "failed": 0 },
      "provenance": { "source": "dataforseo-onpage", "adapterVersion": "1.1.0", "artifactRef": null },
      "limitations": [],
      "requiredFieldsPresent": true
    },
    "performance.lab": {
      "capability": "performance.lab",
      "status": "PARTIAL",
      "coverage": { "requested": 2, "completed": 1, "failed": 1 },
      "provenance": { "source": "pagespeed", "adapterVersion": "1.1.0", "artifactRef": null },
      "limitations": ["one device profile failed"],
      "requiredFieldsPresent": true
    },
    "conversion.path": {
      "capability": "conversion.path",
      "status": "AVAILABLE",
      "coverage": { "requested": null, "completed": null, "failed": null },
      "provenance": { "source": "dataforseo-onpage", "adapterVersion": "1.1.0", "artifactRef": null },
      "limitations": [],
      "requiredFieldsPresent": true,
      "kind": "inferred",
      "validated": false
    }
  },
  "summary": {
    "total": 13,
    "available": 2,
    "partial": 1,
    "unavailable": 10,
    "failed": 0,
    "notConnected": 0,
    "notApplicable": 0,
    "assessed": 3
  }
}
